{
  "$schema": "https://json-schema.org/draft/2020-12/schema",
  "$id": "https://schemas.sddtoolkit.dev/config/sddtoolkit-config.schema.json",
  "title": "SDDToolKit configuration",
  "type": "object",
  "additionalProperties": false,
  "required": ["logs", "models", "workflowTokenBudget", "paths"],
  "properties": {
    "logs": { "$ref": "#/$defs/logs" },
    "models": { "$ref": "#/$defs/models" },
    "workflowTokenBudget": {
      "description": "Total model tokens one workflow execution may use, shared by every call (ADR 0037).",
      "$comment": "Runtime additionally requires an integer-written number (no fraction or exponent, such as 1e5 or 125000.0) and rejects a duplicate member.",
      "type": "integer",
      "minimum": 1,
      "maximum": 4294967295
    },
    "paths": { "$ref": "#/$defs/paths" },
    "validation": { "$ref": "#/$defs/validation" },
    "principles": { "anyOf": [{ "$ref": "#/$defs/principles" }, { "type": "null" }] }
  },
  "$defs": {
    "validation": {
      "type": "object",
      "additionalProperties": false,
      "properties": {
        "sourcePreservationCheck": { "type": "boolean", "default": false }
      }
    },
    "logs": {
      "type": "object",
      "$comment": "File logging is mandatory. console enables only an additional pipe-delimited mirror.",
      "additionalProperties": false,
      "required": ["level", "console"],
      "properties": {
        "level": { "type": "string" },
        "console": { "type": "boolean" }
      }
    },
    "models": {
      "type": "object",
      "additionalProperties": false,
      "required": ["slots"],
      "properties": {
        "slots": {
          "type": "object",
          "additionalProperties": { "$ref": "#/$defs/modelSlot" }
        }
      }
    },
    "modelSlot": {
      "type": "object",
      "additionalProperties": false,
      "required": ["provider", "model"],
      "properties": {
        "provider": { "type": "string" },
        "model": { "type": "string" },
        "reasoningEffort": { "type": "string" }
      }
    },
    "paths": {
      "type": "object",
      "additionalProperties": false,
      "required": [
        "specs",
        "references",
        "specsArchive",
        "workflows",
        "toolchainPreset",
        "principles",
        "templates",
        "providers"
      ],
      "properties": {
        "specs": { "type": "string" },
        "references": { "type": "string" },
        "specsArchive": { "type": "string" },
        "workflows": { "type": "string" },
        "toolchainPreset": { "type": "string" },
        "principles": { "type": "string" },
        "templates": { "type": "string" },
        "providers": { "type": "string" }
      }
    },
    "principleCategory": {
      "enum": [
        "core",
        "architecture",
        "project_structure",
        "security",
        "validation",
        "observability",
        "user_interface",
        "custom"
      ]
    },
    "principles": {
      "type": "object",
      "additionalProperties": false,
      "required": [
        "filenameHints",
        "selections"
      ],
      "properties": {
        "filenameHints": {
          "type": "object",
          "maxProperties": 256,
          "additionalProperties": {
            "$ref": "#/$defs/principleCategory"
          }
        },
        "selections": {
          "type": "array",
          "minItems": 1,
          "maxItems": 256,
          "items": {
            "type": "object",
            "additionalProperties": false,
            "required": [
              "stage",
              "environment",
              "fileKind",
              "categories"
            ],
            "properties": {
              "stage": {
                "enum": [
                  "spec",
                  "plan",
                  "tasks",
                  "implement"
                ]
              },
              "environment": {
                "type": [
                  "string",
                  "null"
                ]
              },
              "fileKind": {
                "type": [
                  "string",
                  "null"
                ]
              },
              "categories": {
                "type": "array",
                "uniqueItems": true,
                "items": {
                  "$ref": "#/$defs/principleCategory"
                }
              }
            }
          }
        }
      }
    }
  }
}
