{
  "logs": {
    "level": "debug",
    "console": true
  },
  "workflowTokenBudget": 125000,
  "models": {
    "slots": {
      "audit_analysis": { "provider": "aws-bedrock", "model": "openai.gpt-oss-20b-1:0" },
      "drift_analysis": { "provider": "aws-bedrock", "model": "openai.gpt-oss-20b-1:0" },
      "spec_generation": { "provider": "aws-bedrock", "model": "openai.gpt-oss-20b-1:0" },
      "repair": { "provider": "aws-bedrock", "model": "openai.gpt-oss-20b-1:0" },
      "design_section_generation": { "provider": "aws-bedrock", "model": "openai.gpt-oss-20b-1:0" },
      "implementation": { "provider": "aws-bedrock", "model": "openai.gpt-oss-20b-1:0" }
    }
  },
  "validation": { "sourcePreservationCheck": false },
  "paths": {
    "specs": "specs/",
    "references": "references/",
    "specsArchive": "specs/_archive/",
    "workflows": ".sddtoolkit/workflows",
    "toolchainPreset": ".sddtoolkit/toolchainPreset",
    "principles": ".sddtoolkit/principles",
    "templates": ".sddtoolkit/templates",
    "providers": ".sddproviders.json"
  },
  "principles": {
    "filenameHints": {
      "core.md": "core",
      "architecture.md": "architecture",
      "project-structure.md": "project_structure",
      "security.md": "security",
      "validation.md": "validation",
      "observability.md": "observability",
      "user-interface.md": "user_interface"
    },
    "selections": [
      {
        "stage": "spec",
        "environment": null,
        "fileKind": null,
        "categories": [
          "core",
          "architecture",
          "project_structure",
          "security",
          "validation",
          "observability",
          "user_interface",
          "custom"
        ]
      },
      {
        "stage": "plan",
        "environment": null,
        "fileKind": null,
        "categories": [
          "core",
          "architecture",
          "project_structure",
          "security",
          "validation",
          "observability",
          "user_interface",
          "custom"
        ]
      },
      {
        "stage": "tasks",
        "environment": null,
        "fileKind": null,
        "categories": [
          "core",
          "architecture",
          "project_structure",
          "security",
          "validation",
          "observability",
          "user_interface",
          "custom"
        ]
      },
      {
        "stage": "implement",
        "environment": null,
        "fileKind": null,
        "categories": [
          "core",
          "architecture",
          "project_structure",
          "security",
          "validation",
          "observability",
          "user_interface",
          "custom"
        ]
      }
    ]
  }
}
